{
  "protocol_version": 2,
  "instance_id": "instance_bbc45f6a751f4604b9a7122561af16f8",
  "project_identity": "",
  "ready": true,
  "active_day": "2026-10-06",
  "turn_active": true,
  "runtime": {
    "generation_id": "generation_b54437c9bfd74388b38c1efe4f219d78",
    "activity": "user_turn",
    "activation": "active",
    "active_day": "2026-10-06",
    "active_request_id": "contract-turn",
    "active_turn_id": "2026-10-06/1",
    "queued_request_ids": [],
    "sources": [
      {
        "source": "workspace.fswatch",
        "state": "running",
        "topics": [
          "workspace.changed"
        ],
        "error_type": null
      },
      {
        "source": "subagent",
        "state": "running",
        "topics": [
          "subagent.connections"
        ],
        "error_type": null
      },
      {
        "source": "reflection.schedule",
        "state": "disabled",
        "topics": [
          "reflection.due"
        ],
        "error_type": null
      }
    ]
  },
  "latest_event_sequence": 52,
  "event_journal": {
    "enabled": false,
    "degraded": false,
    "oldest_sequence": null,
    "latest_sequence": 0
  }
}
